response,most_least,quarter
Just generally what were being taught. I might actually be into data science as a career.,1,sp20
Assignments are interactive and requires implementation of Pandas dataframe,1,sp20
Daily quizzes helped me to keep track of the course.,1,sp20
The announcement part at start of every week. My other courses don't have that part so it may take sometime to figure what to do at the start of the week.,1,sp20
So far I've really enjoyed being able to work on the project as a group and getting better at Python by practicing with the assignments,1,sp20
Being able to learn the material at my own pace,1,sp20
"I have enjoyed the lectures being divided into smaller chunks of specific topics, rather than a large 1 hr video because it makes it easier for me to focus on the lecture.",1,sp20
Everything has been online and due within reasonable time constraints; it gives me a lot of freedom in terms of management of the course,1,sp20
" No. I am new to python, so the speed could be too fast to me",1,sp20
"I have enjoyed the opportunity to examine the various strategies that are best when examining, displaying, and analyzing data.",1,sp20
I think I've enjoyed working with my group the most  because I think we have a good idea for our project (even though getting together has been difficult with everything being online),1,sp20
What I have enjoyed most is the explanations and concrete examples of how what we're learning is directly applied to data right in front of us so we get an understanding of exactly how these concepts are used.,1,sp20
The video quizzes since it keeps me on top of watching the videos and learning the material.,1,sp20
I like how applicable the content is and how Professor Ellis explains things so well.,1,sp20
learning about pandas,1,sp20
The lecture videos,1,sp20
Most of all I have enjoyed the topics and the approach this class takes to teaching the topics. The videos are straightforward and get to the point which is nice. ,1,sp20
The wide variety of knowledge and application in python,1,sp20
"I've enjoyed learning more in depth about the data science process through our course material. It's interesting learning about the gist of what data scientists do from a guest lecturer for an hour, but I've found that it's even more interesting to learn about the different pieces of the puzzle/method progressively in an interactive way. I have a larger appreciation for what data scientists do even more so now. ",1,sp20
I really enjoy the lectures video and how its broken down into separate videos; I am able to understand the concepts more easily and can refer back to the videos.,1,sp20
the flexibility of accessing lectures,1,sp20
"What I've enjoyed the most was being able to learn about new data models, and specifically how approach data based off what type of analysis you want to perform. I think it is very useful know the specifics for each and how to really approach data sets.",1,sp20
The lecture videos were very concise and clear. I also like that each video is short to keep the audience's attention.,1,sp20
Learning about fun concepts like fermi questions,1,sp20
The daily (every other day) podcast,1,sp20
The projects so far walking us through how to do data science have been really cool,1,sp20
The lectures have been adapted to remote teaching better than any other course I'm enrolled in which makes the material easy to consume and motivates me to actually get it done.,1,sp20
Working on the group project proposal,1,sp20
The group projects,1,sp20
I liked how I could move at my own pace.,1,sp20
"I have enjoyed many things, learning python, a new environment(datahub/notebooks) learning introductory steps of data science and how to manipulate that data with python. 

But what I have enjoyed most is learning in general this course does a great job of balancing rigor, work, and comprehension time. All the slides are also very appealing to the eye and therefore easier to digest and comprehend. I really enjoy this course.      ",1,sp20
The group project,1,sp20
The assignments have been the most enjoyable and where I actually feel I put to practice what I learn.,1,sp20
I really enjoy all of the data visualization,1,sp20
Nothing,1,sp20
"How approachable the instructors are, I feel like unlike in other classes the instructors of this class seem friendlier and enjoy helping us.",1,sp20
Interacting with Python and being able to see examples. ,1,sp20
"The lectures, they are well prepared and I learn a lot from them",1,sp20
"the example, like what we can do with the real dataset",1,sp20
"The ease of the course, it helps lower my stress",1,sp20
I've enjoyed the structured videos they are very well done and I like how it is organized. I love that we are actually doing data science as a way to learn about it.,1,sp20
the recorded video,1,sp20
"I really enjoyed how statistics and programming is combined in this course. It starts off very simple and explains both sides. I took a CSE class similar to this course and the professor just assumed you knew how to program and basic statistics terms. There was no datahub so I had to figure out Jupyter Notebooks and python on my own. If I had taken this course before that class, I think I would have enjoyed it more. ",1,sp20
I enjoy interactive learning through Jupyter notebook examples and assignments,1,sp20
The Assignments thus far,1,sp20
How it is broken down simplistically so I can learn efficiently as I am a slow learner and lack a lot of background knowledge that I was scared would hinder me in this class,1,sp20
"I think I've enjoyed the group project the most. I think it was really fun getting to talk to a group of classmates and throw around ideas for a research project. Getting to know what others were interested in and how we might approach answering a question with data analysis was really nice, especially just getting to talk to people again like you would during discussion sections or lecture. ",1,sp20
The way the content is taught is extremely interesting! I like how the videos are split up,1,sp20
I've enjoyed the programming assignments because they help me remember how to use Python,1,sp20
the flexibility that we have with watching lectures,1,sp20
Python pandas practice,1,sp20
"I have experience learning pandas and I can say that I have enjoyed how you have framed this as well as numpy. I also like how you incorporated git. As a DSC major, no one has really explained the processes under the hood in github and I can say that I was really happy to have learned more about it.",1,sp20
I don't personally care too much about the topics being taught in COGS 108 however what I was really impressed with is how much effort the TAs/Tutors and especially the professor is putting in. I recall on one of the past surveys asking for an open answered response I just put in something semi random but I received an email response back that specifically responded to what I had said. I was really surprised because I think that was the first time I ever received a personalized response to one of the hundreds of surveys I've had to fill out. Seeing you all work hard to respond to all the students showed that you really care about your students makes me want to work hard as well! Also the errors in editing you have sometimes are really funny as well.,1,sp20
I'e enjoyed the interactive notebook for lectures as well as being able to work ahead if i need/ move at my own pace. ,1,sp20
"Learning to use Python, since programming is my interest",1,sp20
Learning the way to analyze data.,1,sp20
I really liked learning about the different visual graphs and which each kind is used for. I also like using Jupyter Notebooks! It's so niiice and such a great interface and user-friendly enough for us.,1,sp20
I have enjoyed how thorough the lecture videos are. They help me learn the most.,1,sp20
The idea of manipulating large sets of data and cleaning it was entirely new to me and it has been a very interesting experience,1,sp20
learning visualization and data analysis methods,1,sp20
The idea of working with data (such as A2 assignment),1,sp20
"I love how the class is 1/2 programming and 1/2 subject content. It keeps thing new and engaging. If we only learned code, I know I would be overwhelmed very quickly. If we learned only subject content I know I would feel bored. The mix of both makes me engaged. I also feel if the two weren't mixed in the way they are now, I wouldn't be able to make the same connections with code and content",1,sp20
The data analysis that we covered and what it means in relation to the final project,1,sp20
Understanding data science,1,sp20
I enjoyed attempting to think from the perspective of a data scientist in formulating a project approach.,1,sp20
ummm seeing many different graphs,1,sp20
"Being able to see the material learned in my ECON and MATH courses being applied in a different way. Also the organization for this class is impeccable, I can see what needs to be done at any time all in the modules of canvas. ",1,sp20
Brainstorming questions for the project proposal,1,sp20
It's been decent so far. I liked learning the basics of coding ,1,sp20
How applicable it is to real life,1,sp20
The application of the skill itself. ,1,sp20
I have enjoyed working on the assignments because it allows me to apply what I have learned from watching the lectures.,1,sp20
I enjoy learning the course most by learning myself.,1,sp20
Practical solutions to data science problems that we could encounter in the wild.,1,sp20
Python and Data Analysis,1,sp20
the material itself,1,sp20
The bite-sized lecture format :),1,sp20
I have enjoyed the quality of the content and assignments. They are very clean and there is a lot of effort to help students learn the material,1,sp20
learning about data analysis,1,sp20
I like coding.,1,sp20
"Yes, it's fun and this is the most fun class i am taking right now",1,sp20
The assignments. The lectures are informative but you only understand the applications when you do the assignemnts. ,1,sp20
Writing code. There is immediate feedback and feels like I am learning something useful.,1,sp20
"I've been enjoying the topics covered in the discussion section, which is more focused on the programming aspect of Python. Although as of right now most of the topics are stuff like data structures or concepts that I already have a grasp on, it's really improving my understanding on these things. As a math major, it's a very common occurrence for me to be able to do something programmatically, but not actually understand why it works.

It's also nice that the a lot of the examples on the video lectures are real case studies. It makes it easier to grasp a concept. Some of the stuff like ethics on data science are also things I've never learned before, so it was really interesting for me.",1,sp20
I enjoy the assignments the most because it is practical training.,1,sp20
Learning about how to format data,1,sp20
Group project is very interesting and our group picked a topic we all had a lot of interest in which makes it even better doing the actual project,1,sp20
I've enjoyed the programming in Python with Pandas. Messing with data in a relatively simple manner is intriguing. I look forward to performing real analysis with it soon.,1,sp20
I have enjoyed learning about how to tell when data is well-presented or when it should be inspected to tell whether or not the chart/graph is biased.,1,sp20
the quizzes have been a good review of stats ,1,sp20
Manipulating data sets. Working in a team.,1,sp20
"Assignmnets : I like to have real expereince with Python and the process of doing the research
Lectures : I really do appreicate how staffs are structuring the lectuers (small vidoes, quizes to follow )",1,sp20
"Yes, I enjoy this class. ",1,sp20
The online lectures and the convenience of doing them,1,sp20
Data Science is very practical in real world experiences.,1,sp20
Using Jupyter and learning about Python,1,sp20
I have enjoyed learning about the process of Data Science I find it fascinating and picked up a data Science minor ,1,sp20
group work,1,sp20
"The short videos and quizzes, they help me stay focus and understanding the materials.",1,sp20
The videos are easy to follow and broken down well.,1,sp20
It introduced a lot of new methods l didn't hear before to do the data anaylsis ,1,sp20
The short online lectures paired with the quizzes really helps me keep up with the class,1,sp20
the PAs are understandable and concise which I like,1,sp20
"python programming since I haven't programmed in python in a while, it's fun to relearn it.",1,sp20
"The structure of the class, having video lectures all posted on github before the week starts allows me to complete them whenever I have time and really lowers my stress throughout the week since I completed my quizzes earlier in the week. ",1,sp20
Working on the assignments and talking with my group about potential project ideas,1,sp20
getting in a group,1,sp20
Programming assignment,1,sp20
"I enjoy the quizzes being short and concise, not overwhelming or a hassle but enough to test knowledge.",1,sp20
Yes. The instructions are incredibly clear and concise and the personal feedback is appreciated.,1,sp20
"Lectures are easily accessible so I can pause when I need to, or go back and watch an explanation over and over again until I understand it!",1,sp20
"I've really enjoyed understanding and learning the different ways that data is actually used and parsed. Previously I had a blackbox mental model of how it ""big data"" worked, but I think this class is helping me ground it into how it actually happens.",1,sp20
videos are very informative ,1,sp20
"So far, it's been all the new concepts from data science that is pretty interesting as well as the overall flow of the class.",1,sp20
Review about python,1,sp20
Uhhh the videos?,1,sp20
I like your teaching style; you give very clear examples and explain things in interesting and tangible ways.,1,sp20
Learning about the different kinds of analyses,1,sp20
"The consistent attention from professor ellis to our learning. Lectures are clear and concise, assignments are fair and promote learning",1,sp20
Video lectures!,1,sp20
Learning Python!,1,sp20
"Having the lectures for the week released early, as I like to do it all on either Saturday or Sunday.",1,sp20
The project. since I get chance to communicate with others,1,sp20
The assignments,1,sp20
"the videos are posted online in a timely manner, TAs are accessible and answer my questions about the assignments",1,sp20
"I like the multiple short youtube videos instead of long lectures! It is way more convenient for my short attention span, and helps me focus and learn much better.",1,sp20
Getting to learn the process of data analytics. ,1,sp20
The lectures explain concepts very well ,1,sp20
learning python,1,sp20
The availability of all the lectures,1,sp20
programming,1,sp20
I really like that the videos are pre-recorded and that you release them ahead of time allowing for us to work at our own pace on our own time.,1,sp20
"I enjoyed learning python, I love learning new languages.",1,sp20
"Too early to say, but conceptually, the content. I haven't dealt with much that we have learned practically as I have not started on A2, but I am excited based on the topics we have discussed in lecture. ",1,sp20
"Learning about the different ways to visualize data has been really interesting. The presentation of data is something that I didn't think too much about before this class, so it was really interesting to learn the different ways data can be visualized. Things like how a data table is organized and how charts differ from one another put data and statistics into context. ",1,sp20
"I think the Professor is really good at presenting complex topics in an easy to understand, and less daunting manner.",1,sp20
"I like the coding part, cuz using code to solve problems is very cool.",1,sp20
I like that the videos are split by topic bc it makes the content more digestable. also the quick quizzes at the end are a good grasp check.,1,sp20
the material told in class,1,sp20
"The fact that quizzes are always Monday, Wednesday, and Friday. It forces a small regularity to my schedule. For example, one of my other classes has weekly quizzes, and I procrastinate until the day that quiz is due to catch up on an entire week's of material. Another one of my classes only has 3 grades: a midterm, another midterm, and a final. Yep, that's it. I only started studying for the first midterm the day of the midterm.",1,sp20
data,1,sp20
the practical skill been taught,1,sp20
"So far, I have enjoyed the fact that I am able to further engage my interests in data analytics. I have always enjoyed looking at data to deduce conclusions about trends, which is definitely being engaged in our final project.",1,sp20
The variety of datasets we have looked over is very interesting!,1,sp20
Being able to think about a project with friends,1,sp20
The lecture is clear ,1,sp20
Taking quizes after watching the video. Because we can really focus on the material and test our learning result quickly.,1,sp20
Its application of data science,1,sp20
I really like how applicable it is to our interest,1,sp20
Project planning and brainstorming ideas. Being able to talk to others and think of a cool project together is pretty fun amidst the pandemic.,1,sp20
"Deciding upon my project subject, we decided to use datasets from riot games which created my favorite game of all time League of Legends.",1,sp20
Programming and pandas. It is nice to see how programming skills can be used in data analysis and visualisation.,1,sp20
online classes. I don't have to wake up at 8 am in the morning!,1,sp20
Able to concretely learn things about data science that I had only loosely learned before.,1,sp20
I enjoyed learning about the different concepts associated with data science and how they are relevant in different real world examples. Learning about git was also very useful information.,1,sp20
The professor's assumption that with some terms/ideas we might not be familiar with yet. This has elevated some pressure off the students for sure! I also think that splitting the lectures into parts to focus on specific topics has been important for me to sort and locate that information when necessary.,1,sp20
"I think data collection is interesting in itself, and this course is great in educating me on how data is collected, sorted, and analyzed! The lectures and notebooks are very clear so far, which I greatly appreciate.",1,sp20
the understandingness of the teaching staff,1,sp20
I've most enjoyed completing the coding assignments and learning more about pandas,1,sp20
Lectures are well organized and the assignments are well written,1,sp20
learning python and being able to work with data with python,1,sp20
"Since I am new to data science, I really like the goal of the course: to explain phenomena with data and analysis. It has sincerely sparked an interest in data science",1,sp20
The juypiter notebooks lectures because I like to be actively learning,1,sp20
"I enjoyed learning the fundamentals of cleaning and wrangling the data. Also, when I really implement those techniques into the real work, it is really useful and engaging that how we collect the data and facing lots of issues of handling the data. ",1,sp20
Writing code and seeing the code work,1,sp20
I have enjoyed the most working with Python,1,sp20
"I've enjoyed the lectures the most COG108, although with the unique circumstances in which online learning can be very stressful I still find the course to be intellectually stimulating and I appreciate the way the videos are divided.",1,sp20
Learning more about python.,1,sp20
learning about python visualization methods,1,sp20
I have enjoyed the flexibility of the class in general and I have enjoyed the subject matter that this class has to offer. This could be very useful for me for my career :).,1,sp20
"It's application based. I think that is the most important thing. It's nice learning the theory behind it, but trying to come up with a project to apply our knowledge really helps us prepare for actual Data Science stuff.",1,sp20
"lectures are a good timing and style, assignments are alright so far. I like the no tests thing (besides quizzes) ",1,sp20
The professor really explains things well. The tests are representative of what is in the lecturers. Also splitting up the lectures makes learning the topics easier. The examples we go over in lectures are pretty interesting and shows how what we're doing applies to real life.,1,sp20
"I like the coding part, cuz using code to solve problems is very cool.",1,sp20
Quizzes aren't helpful,0,sp20
Coding aspect,0,sp20
the quizzes being kind of hard :(,0,sp20
the workload is a little bit heavy ,0,sp20
Having the quizzes but because I will like to have 2 tries,0,sp20
The quizzes... I keep losing points and the time constraint makes it difficult and stressful :(,0,sp20
"I am not a big fan of all the quizzes we have to do. We dont have enough time for the quizzes and even if we do watch the lectures, I think the questions are still quite difficult. I also think the homework is quite difficult ",0,sp20
I would like lecture quizzes to be due on friday of each week,0,sp20
Some of the quizzes are hard,0,sp20
Lecture Quizzes; every other day completion with fairly high difficulty (time/single attempt),0,sp20
I don't like the video quizzes. Some of the questions take me longer than others to answer but we only get one minute per question. I've also accidentally started quizzes a few times.,0,sp20
I hope we can use github a bit more before the final project because I feel very unprepared with how github works still... I'm afraid I might forget something important for the final if we don't practice using github more. ,0,sp20
"I wish we could focus a bit more on coding plots and like different things we could do with that, maybe go into greater depth in that area",0,sp20
"The 30 minute long videos :( But this isn't really an issue, it's just me being a lazy boi ",0,sp20
"As with all of my other classes, remote learning is a challenge. As someone who gets stressed very easily, it is very difficult to avoid losing a few points on the lecture quizzes in situations when I am unable to recall the specifics of the lectures in the moment. And those losses have added up.",0,sp20
Quiz. Too many quizzes to take.,0,sp20
I dont really enjoy the quizzes but it makes sense since it forces us to watch the lecture,0,sp20
"I don't like the clarity of grading. I feel like the quizzes often have some questions that ask about something that's really nuanced & I understand that the questions can't all be easy, but I don't think those question topics get enough attention in the video to give us the opportunity to have deeper thought about them. I also wish there was a way to turn in the assignments and see the grade on them before they're due (without necessarily seeing the correct answer) so we can get a better idea of how they're going.",0,sp20
Some questions in the quizzes are pretty tricky even though I pay close attention in lec I may still not get it right.,0,sp20
"I wish we could divide the course into two or three. Though it serves as a good stepping stone for learning data science, for many cogs students its where that course experience ends. To supplement this, Ill be taking cogs 109 and 188 but those classes are taught in Matlab. Itd be nice to have a central theme to some of these courses as python is arguably the most popular language for data science right now. ",0,sp20
"I think the hardest thing for me so far in this course has been learning how to use github, since it is a very different platform for me and I have never used anything like it before. ",0,sp20
"I feel like I am confused about many aspects of the course, whereas many other students are so far advanced that everything is a breeze. I only took cogs 18, so I am only really familiar with Jupyter notebooks; Github is very confusing and I don't really know how to do code on my local computer outside of jupyter. Additionally, the final project made me really confused, and I think I wrote a terrible proposal because I missed some of the information on Piazza.",0,sp20
"Not much. I confess that having timed quizzes give me a probably unwarranted sense of anxiety, but that's it :)",0,sp20
The quizzes.,0,sp20
Definitely keeping up with the lecture attendance quizzes...,0,sp20
I don't think discussion sections are useful. ,0,sp20
"So far, what I have least liked about this course is that it is a lot of self learning (like many courses), and it can be a little hard to take in all at once. ",0,sp20
"that unit tests are grouped in their grading. i.e. if a function is required to work and pass unit tests a, b, and c, we lose all potential points if it fails just one of them.  I understand why however, I just think it may be beneficial to us all to find these potential bugs beforehand.",0,sp20
"I think the pre-recorded lecture isn't conducive to me getting the most out of the course. I enjoy engaging with the material and my peers, and asking questions in real-time. I understand the need for asynchronous learning, but it'd be great if we could still meet up during lecture times to go over the material in real-time, if possible.",0,sp20
I forgot to take one' day's quizes and I lose 15 points :(,0,sp20
due dates for quizzes are a bit tight. I felt a bit stressed out since I am taking 5 classes this quarter.,0,sp20
working on the group project virtually- make it difficult to collaborate and bounce ideas,0,sp20
"Work with my team: I didn't know my teammates before and after working on the proposal, I have realised our quality standards are quite different. ",0,sp20
