enjoyed_most,enjoyed_least,,,,,
I think the concept is beneficial for me towards my future career. There are a lot of application that I can use in the future.,I think there are too much work for me to do every week. There are different assignment and quiz for students. It is hard to memorize when to submit which assignment.,,,,,
"I like most about COGS 108's assignments and deadlines, very straightforward.","I think randomized grouping is not very efficient, though I understand that is what it like in working environment. But we can only have fraction of time meeting each week so the whole project is going really slow.",,,,,
I enjoy working on the discussion assignments and the lectures are pretty engaging as well with the Jupyter notebooks.,I think the instructions for the assignments can sometimes be a little vague so it takes longer to understand exactly what the question is asking for.,,,,,
The guidance in the work we have to do has made it less stressful for me. It makes me want to start earlier and work on it because I feel like I can possibly figure it out even though I'm not a strong coder.,"The final project is intimidating, especially with random group members that are sometimes unresponsive or do not seem like they really want to try.",,,,,
I enjoyed learning about Python because it's a new and more commonly used coding language that I did not previously know.,"honestly, the data visualizations because I'm still learning Python so it's been more time-consuming than I predicted but it's not so bad. The group project is also a bit confusing but we're just getting started so perhaps I'll understand more with time.",,,,,
Great pace that I can keep up with. I can follow the lectures along and am learning at the same time.,Having some connection errors with datahub. Not sure how it can be fixed though.,,,,,
I enjoyed the first 2 discussion assignment that wasn't as hard,"Navigating to the material. I usually use computer for jupyter notebook and iPad for pdf lecture. If you can upload the pdf of lecture on canvas, that is much more accessible for me!",,,,,
We learned a lot about how to process data.,N/A,,,,,
"So far in Cogs 108, I have enjoyed learning about how to use different graphs and coding these graphs during our lab and A2 since I feel as this is a necessary tool that we will need to know for our future roles in our professional careers.",I have disliked the group project in this class so far as I believe it may take a long time to accomplish the whole project but am still ready to work with my group and complete it as we have a great start already.,,,,,
"The parts of COGS 108 I have enjoyed the most are:
1. The (optional) engagement/participation in lectures with iclickers, since it feels like more people show up to the class and attempt to learn
2. The option to go to discussion for guidance on labs
3. The detailed instructions within labs and assignments","The thing that I have liked least about COGS 108 is that I had to pay for an iclicker app subscription because I didn't have and want to use the physical kind. I understand that it's not really the instructors' fault, but of course I don't like using up money.

Other than that, everything is fairly smooth sailing.",,,,,
"Working on the project is an enjoyable experience because we have the freedom to select any topic that interests us. This hands-on approach allows us to apply the theoretical knowledge gained from textbooks to real-world tasks, giving us a sense of truly utilizing what we've learned in practical scenarios.","At times, the material covered in COGS108 and COGS189 seems to overlap, particularly during the initial three weeks. However, as the courses progress, it becomes apparent that COGS108 focuses more on data programming.",,,,,
I like the pace of the lectures because it is not so fast.,I don’t think I learned a lot of technical things.,,,,,
I like applying what we learned to assignments and actually working with data in a workbook and seeing it come together,"Nothing in particular, maybe that lectures aren’t spent working on harder material that the assignments showcase, concepts in lect are quite simple but actually applying them is hard",,,,,
"Learning through the labs and assignments. I am more of a hands-on person, so being able to work through it on my own to learn, rather than listen to lectures makes me enjoy the class a lot more.","Sometimes the instructions on the assignment and labs are unclear. Sometimes I worry that I have points knocked off even though all my assert tests pass. I also have never used github before. There was a lecture on it to work through it, but that doesn't guide me through it very well. I have also done the github tutorial, but it still doesn't make sense to me.",,,,,
I enjoy the lectures. It's not boring.,"I hate GitHub. I have no clue how to use it. We have to submit our proposal on GItHub and I'm scared I'm going to mess up. My members also don't know how to so like, it is up to me apparently, which is no shade to them, just like :(.",,,,,
I mostly enjoy using python in order to wrangle data.,The prompts in the discussions and assignments are open ended in regards to the approach we can use which is fine but sometimes what is looked for in the end result is not entirely clear.,,,,,
I like how clear and intuitive the course is structured.,I kind of do not like how the quiz and lab are given out on Friday and due Sunday. I personally would prefer finishing all my assignments during the week days and have some personal time on the weekends...,,,,,
I have enjoyed working on the labs. They provide excellent hands-on practice for the concepts we are covering.,"The fact that we didn't get to choose our own groups, but I understand that choice. Still, it would have been way more fun to work with people I am close with and we could probably finish one of the greatest projects of all time.",,,,,
ATTENDING CLASS. I like the interaction that happens in class,group project.,,,,,
the groupwork,PA's,,,,,
I enjoyed most the systematic learning of using pandas and other python tools to analyze data.,N/A,,,,,
The course provides plenty of opportunity for us to practice.,"While it is a relief that we don't have any exams for this class, I am a bit lost about how to study for this course.",,,,,
I like the pace of the class and how it is structured where we learn about concepts and then get to see them in action in the notebook.,"I wish we could get more insight into the code, some f the discussion labs were more open ended and I had to search up a lot of the stuff.",,,,,
The progress I have been able to make in working with data. Early on in the course I felt very unfamiliar with navigating data but this course has made it very procedural and more easy to know how to approach large datasets.,n/a,,,,,
I have enjoyed doing the lab assignments the most because the questions/tasks are always related to finding something out about the data so it feels like a game and worthwhile; even for someone that has been overwhelmed by coding assignments in the past.,"By the same token, I have least liked the coding aspect but not for the application of it, more like the concept of coding itself. However, it's just a learning curve and a personal challenge it's not that serious of a dislike. I do appreciate that I was fairly warned at the start of the quarter!",,,,,
The guest lectures were insightful in what data science does,it's been pretty good so far,,,,,
I am enjoying learning about the various ways we can represent data visually.,"I think the pace of this class is ok, but it is kind of daunting seeing previous projects and how time consuming they may be. I am worried about time management regarding this class' big project and my other classes.",,,,,
the guest lecture - it was neat to see how data science applies in the industry and to see how someone similar in our position is now in the working world,the labs - these are a lot more work than I anticipated and they sometimes cover material that we did not go over in class,,,,,
I have enjoyed getting to learn about data science and what it entails.,I have liked the least how the labs/assignments descriptions and questions are confusing which makes them hard to understand what it is asking for.,,,,,
"I really enjoy learning more about data science, and I actually enjoy doing the assignments on datahub, specifically something like A2. Those are a bit more guided but it is really helpful in helping me understand specific functions and how to use them.","I'm a bit unsure how we should be pacing our projects and how often we should be meeting. I suppose I'm used to a team project being the main focus of the class, and not so much as a side thing that students have to do entirely themselves. I think having a requirement to go to at least one discussion time would help my mindset about this class, but I realize that it gives students a lot of flexibility with the structure right now.",,,,,
Learning python through datahub,The fact that we cannot choose our groups for the final project. I feel like the groups would mesh better and be able to communicate better if we could choose them ourselves or at least choose some of the group members,,,,,
The assignments,The group project has been a bit rough.,,,,,
"I like how the labs really help with the assignments. If I try to do the assignment before the lab, I definetly struggle more. I also like how it is easy to get help just by looking at each library's documentation.","I think it has been a little hard to follow the slides, but it is still manageable.",,,,,
I like learning how to use pandas and seaborn to plot,"Sometimes, labs can be more challenging than assignments and able to see the test cases would be really helpful.",,,,,
Flexible structure so that we can attend lectures at different times or re-watch,"Labs can be a little confusing since there is less guidance; also think it has been a little hard connecting lecture content to the labs at times.
It also would have been nice to pick our group members for the project, but I understand you are studying how self-picked versus assigned groups work.",,,,,
It's sometimes frustrating but at the same time fun to organize dataframe to be tidier. I also especially enjoy exploring relationships between data and making graphs with datasets. Sometimes they can show me very interesting and unexpected correlations.,"Probably the wrangling data part. The syntax are complex and hard to remember. Errors occur here and there, and they appear so easily with each additional line of codes... I always have a headache trying to deal with unorganized data.",,,,,
I enjoyed how the hw and project are so tightly connected to the lecture.,I would like this class to be a little bit faster and include more topic.,,,,,
"The guest lecture, I thought it was very informative to see how what we learn in class can be applied in the industry.",I don't have anything particular in mind but maybe the constant deadlines/due dates is hard to track,,,,,
"Guest lecture, as it provided nice insights into data science careers","Felt unprepared for lab 3 despite going to lecture,",,,,,
I've never used the pandas dataframe so figuring that out through assignments/discussions is fun.,Communicating with my group because its hard to get 5 people on the same page.,,,,,
"So far, I have enjoyed the discussion labs the most. They have been very helpful in teaching me how to do data science practically.","I have liked the group project the least so far, as it has been challenging to communicate and find time to work together.",,,,,
I have really enjoyed the discussion assignments. They are quicker than assignments but I feel they cover really important concepts for data science.,"I don't really enjoy the group project. I feel as though if we were able to pick groups, it would be much better on coordinating schedules, but because of the randomization it becomes really hard to meet consistently.",,,,,
Coding. I enjoy writing code more than visualizing data or explaining findings.,Haven't really touched on anything yet since most of the course has been coding up to now. But now we are moving into our projects so I know there is going to be a lot less coding going on and more thinking involved with creating a project. There is going to need to be analysis and explaining of findings which is not particularly fun.,,,,,
I like the hands on work in the assignments that really give us the opportunity to implement everything we learn.,"Sometimes the class feels slow, because of my previous experience in Data Science, but I still enjoy it.",,,,,
I have enjoyed the content in COGS 108. I think the professor explains the concepts very clearly in lecture and that discussions/assignments are a good application to really learn the concepts.,I am not sure. I think I would like more TAs/IAs to hold remote office hours or sections because it feels easy to drop in that way while working on assignments.,,,,,
"I have enjoyed learning about the real world applications to coding, as it's not apart of my major so there's a lot I don't understand about its application in data science.",I am pretty bad at coding and it's really unfamiliar to me so sometimes it's really hard for me to see where I'm making a mistake in the homework.,,,,,
"I most enjoyed the lectures, as I feel like they help a lot with the homework as well as it is really engaging with the iclicker questions",I least like the assignments since I think that there is a lot work for the class,,,,,
"I have really enjoyed the material so far, all of the assignments have been very interesting. So much so that I would like to take more data science courses/look for more options after graduating related to this field.",Maybe some more resources on debugging could be helpful.,,,,,
I enjoy exploring more about different packages in Python that I have not had the opportunity to learn about yet. Being able to expand what I can do using a variety of packages and learning different ways to best perform an action has been exciting for me to experience.,"Communicating with my group has been difficult at times, but I understand communication is always difficult in group projects and I need to learn how to best communicate with group mates regardless of if we agree or not.",,,,,
Being able to learn more about handling datasets.,I wish to have more application of the things I have learned.,,,,,
I have really enjoyed learning more about Github and practical skills like making pull requests that are very helpful for working on coding projects and future jobs.,The group work assignments are a little long.,,,,,
Assignments in Jupyter notebook are easy to follow and fun to work on,Some of the discussion problems don't really specify which dataset is being used,,,,,
I enjoy the lectures because they are engaging and Prof. Ellis explains the content really clearly. I also like the amount of guidance the assignments have.,"Some of the weekly labs have been kind of difficult. I like the quizzes, but there are so many things to do by Sunday it gets hard to keep track of them all.",,,,,
How we look at direct examples of what we are talking about in lecture.,It's been more difficult to do the assignments and quizzes because the material doesn't fully tell us how to set up some things.,,,,,
Meeting the people in my group and working on the project.,Personally the assignments and discussions have been boring for me since I have learned all of that information in prior classes I have taken,,,,,
"I enjoyed the flexibility in this course. I can work at my own pace and plan out my own schedule. Since I live off campus, I can choose to just watch the lecture recording on my own time. Also, I have plenty of time to work on the assignments at whatever pace I chose since I can start one day and finish another as the assignments give me two weeks to finish them.","I don't really like the stress behind assignments with the hidden test cases. Even though the hidden test cases are just more of a generic check rather than edge case checks, I get stressed over misreading or overlooking a part of the instruction and missing points on the assignments. I think it would be nice if students were guaranteed a certain grade on assignments given they pass all of the visible testcases.",,,,,
"learning python in the first place! theres a lotta assignments but they are very doable, even for beginner programmer, and make it very clear what you are learning and its applications","the group project, but not bcuz my group or the project itself, just because the only time we are all available tends to be inconvenient for me",,,,,
Project groups because it's more collaborative than individual homework assignments.,The weekly quizzes because they are annoying.,,,,,
"I've learned how to use Python to clean data, draw charts, plots, etc. in a research which were things I did not know/ learn before.","I don't have anything dislike about COGS 108. There is only one disadvantage that our group comes from 2 sections. Therefore, it is harder for us to figure a common time to work on together weekly.",,,,,
"I liked the guest lecture from the data scientist at Cruise the most. It was very insightful to hear about the real life applications of the tools we are learning. It was also thought provoking, and had me rethinking my perception of the mechanics behind designing complex programs like automated driving.","So far, I feel that some Jupyter notebook assignments have been overly confusing. I found that me and many of my peers had trouble specifically with D3, which I think could have been fixed with cleared instructions.",,,,,
"I like the class structure, it is pretty clean and well organized. Easy to turn in homework without hidden tests.",Assigned groups. I want to work with people that I choose.,,,,,
"A lot of it is review/relearning familiar concepts to me, but I enjoy Prof. Ellis' way of teaching it. It makes me feel like I'm seeing things from a slightly different POV, and not just tiredly relearning things, especially the most recent topics covered.","The beginning part that was just Python coding review was pretty boring, since I have more of a Python background, but I understand some students don't have too much experience with Python/Github/etc.",,,,,
I've really enjoyed using the Pandas library alongside Seaborn. Cleaning and wrangling raw data and then getting to generate visualizations is a rewarding process.,"There is nothing I have disliked yet, but now that we are getting to working with statistics concepts, I foresee myself enjoying this topic a little less since I don't enjoy math much. Despite this, I see its importance and am still eager to learn it.",,,,,
The lectures: They're engaging. I also liked the guest lecture. It is useful in understanding how the application of what we do in class could look like in a career.,"I feel as though the labs (D2,D3....) are quite difficult and dont always cover what we did in lecture. Requires quite a bit of outside research.",,,,,
I have enjoyed the hands on coding assignments. I like how much freedom there is in finding and researching our own methods for data related questions.,I feel like the pacing of this course is difficult but this problem is mostly to do with the quarter system. I think it is rough that I am trying to plan a project that could or could not deploy a model when I don't yet know how to make a model.,,,,,
"Python coding, it's very relaxing.","Weekly quizzes, I feel like some of the tick multiple choice questions are a bit ambiguous / hard to answer.",,,,,
Learning to use GitHub properly,Lectures don’t feel directly related to our current work on the final project,,,,,
assignments due on the same day so it's easier to keep track of deadlines,"some of the assignment questions are worded confusingly, so it's hard to figure out what the question is asking for",,,,,
I've enjoyed coding in python because I've been coding in mostly java and python over the past year.,It's been challenging to coordinate with my group because everyone's schedules are so busy and don't always match up.,,,,,
Learning about data and doing hands-on learning thr,"The group project is starting to feel very stressful - especially since it feels like the amount and depth of deliverables expected this week (Project Proposal) is so much more than the first week after groups were made. I'm excited for what we'll make, but I wish we had more time to work on the proposal, or were sorted into groups earlier in the quarter so we could submit the proposal before midterms (maybe week 3 or week 4 instead of week 5).",,,,,
learning about the importance of being able to interpret data and the most suitable ways to visualize such data! i love looking at random graphs and data visualizations (r/dataisbeautiful is a very entertaining subreddit to look at) so it's been really fun learning about it more in depth,coding but that's because i'm a cog sci design major who hasn't taken a coding class in a few years,,,,,
"I've enjoyed honing my coding skills the most, even if it is a little tedious and frustrating",I haven't enjoyed being stuck on questions and realizing there was one small thing I needed to change.,,,,,
"I have enjoyed how well-organized the class is, especially how clear the instructions are on the assignments.","As a data science major, most of the content in the class so far has been review, making the course easier that I expected. I also would have liked if we could choose our proejct groups.",,,,,
data analysis,group project,,,,,
I like the iClicker questions and being able to discuss questions with classmates.,"Sometimes in class, the Jupyter notebook will run into an error or say a method is out of date on my end and if I can't fix it it prevents other crucial codeblocks from running.",,,,,
I like the breadth of what we cover. I enjoy learning about all aspects of data analysis and the variety of libraries that we use.,"Nothing really, so far my group is mostly been good. A couple people have been absent to meetings but they have been doing their work asynchronously.",,,,,
"do the DI, really help me learn a lot from it",none,,,,,
"The lectures, Professor Ellis is very clear, consistent, and professional in each lecture. It's a joyful experience I might add.",Everything seems reasonable so far,,,,,
The lecture is very interesting,"The instruction for labs and assignments were sometimes not very clear, which made me spend more time on the labs ans assignments",,,,,
Refreshing my skills in data analysis with python libraries,"Some of the discussions and assignments have vague instructions, and can sometimes be tedious to do",,,,,
"What I have enjoyed most about COGS 108 would be learning about pandas and Numpy. This is because I am a Math-CS major so I already had experience with coding in Python; however, I was completely new to using pandas and numpy for data so it has been enjoyable working with new libraries","What I liked least about COGS 108 was the first couple of review lectures on python because I already knew python so it was very boring and unnecessary; however, I understand why it is taught as many students need a refresher on python and coding",,,,,
"- good organization of content -> very good review and encapsulation of the topics
- also all things being due on the same day is very helpful -> more memorable
- there are also some interesting rules being brought up, like the one about 10s and estimation -> just cool pocket knowledge that's useful",not being able to choose my group,,,,,
I have enjoyed learning about data visualization because it was really cool seeing how different graphs can be generated and customized. I found it very helpful and interesting.,I have least liked learning about GIthub because it was confusing to me. I didn't fully understand how to do the assignment for it in D1. I wish we could have gone more in depth with this in lecture.,,,,,
"I enjoyed the most about web scraping and using different kind of plot such as sns because I happened to be using web scraping in research and other class, but COGS 108 lecture slide and code really helps a lot to understand conceptual parts. Also, other classes that I'm taking so far didn't discover seaborn plot, but it seems very useful tool to draw the data.",I do not have it.,,,,,
Coding exercises because it is enjoyable to me,"Some weeks have more homework than others, I don't mind the workload but I would prefer it to be more consistent",,,,,
Learning more about pandas and python.,A lot of things to remember and consider for my grade throughout the week,,,,,
Coding in python and completing the assignments,"Learning how to use these new libraries and methods, but still somewhat enjoyable.",,,,,
"I have enjoyed the professor! How positive energy she has about data science, the talks she shows us, and the way she teaches.",I have least enjoyed coding (as a non-computer science major).,,,,,
The plentiful resources available to succeed effectively in this course in all types of assignments and learnings.,"I like that the deadlines are all due midnight of Sunday for each week, although this can sometimes be tricky as working in a group for the project, things tend to be left for the weekend, which can be tricky to navigate last minute.",,,,,
I think I’ve really liked the assignments on Datahub. I think they really demonstrate the material well.,There hasn’t been much that I’ve really disliked so far.,,,,,
