enjoyed_most,enjoyed_least,,,,,
"The most enjoyable aspect of COGS 108 could be its focus on the ethical dimension of data science. It emphasizes the need for data privacy, informed consent, and the responsible use of data, advocating for continuous ethical scrutiny throughout the data science process to prevent harm and inequality.",Some part of the assignment is a little bit hard for me. But I will work it out.,,,,,
The assingmenta,clicker questions,,,,,
"I've really enjoyed our hands-on work with python - learning through practice has helped me retain the content pretty well, and I feel like I'm actually building applicable real-world know how. I really appreciate the emphasis on ethics in this class as well; it's eye opening and thought-provoking to recognize that data is not objective, and it's a good reminder to have as we learn to work with it.","Sometimes I feel like the content in the labs doesn't reflect what we learn in class; in lab D3 I ran into a task I didn't know how to implement. I read documentation, but documentation can be gnarly to sort through at times.",,,,,
I really enjoy the live demonstrations and the applications to cleaning datasets and creating visualizations. I've only self learned pandas for a lab project before so I only knew the basics and available usage of pandas but not how to prepare and clean data.,I don't have anything particular in mind.,,,,,
"I like how there is no midterms and instead we have weekly quizzes, because it stops people from having to cram everything for a midterm and I feel like generally we learn the topics better.",I have no complaints I feel like the amount of work we are given is fair.,,,,,
"I enjoy both the guest lectures and the project-oriented format of this course. I like to put my knowledge into practice and applying what I've learned to real-world scenarios, and the project-based structure facilitates this experiential learning. Also guest lectures help give me insight on the road path people take and what it is like to work in industry.",What I like least about COGS 108 are the assignments. I fairly new to pandas and seaborn so I spend a lot of time looking up the syntax and functions to understand what I am doing.,,,,,
I really like the labs and assignments because they are very hands-on coding where I've learned the most,"I strongly dislike working with my team, as they are pretty unresponsive and disengaged. I think it would be great to have teams assigned within sections so that it is easy to meet in person, since I think that type of interaction is much more conducive to a positive group dynamic than the occasional discord voice chat",,,,,
The assignments are fun and let me practice my pandas/visualization skills.,Assigned groups for the project. We should be able to choose who we work with,,,,,
"The programming, because I like being able to visualize data in an efficient way",Some of my groupmates are not pulling their weight,,,,,
"I have enjoyed the Data Labs! I think they are nice because they really allow me understand how to visualize the data. In addition, the open test cases are nice because I get immediate feedback on what I am doing and its accuracy.",I feel like the length of the quizzes have increased and the time it takes me to complete them has gotten longer. I wish the time allocated to do the quizzes could be extended by like a minute! But overall everything has been pretty smoothly with the class.,,,,,
I have enjoyed the lectures. I think that the lectures have been very informative and helpful for learning the material being taught. The clicker questions make them interactive and force me to integrate the information into my brain.,"I would say that I like the assignments the least because they do not tell me if my answers are right. They just tell me if my answers are in the correct format, but not if what I have done is correct. This means that I am not sure if what I have done is the correct thing or if I truly understand the content.",,,,,
Learning about pandas since it was my first time interacting with it,GitHub because I found it confusing,,,,,
I really enjoyed doing the labs where I get to experiment with what we just learned and it's low stakes.,Nothing major that I don't like about this course. I would say having all the assignments due on the same day kind of stresses me out sometimes.,,,,,
I have learned being able to learn something new each time and being able to interact well with lectures. It's also nice being able to get my brain going with with something different I'm not used to.,"Personally I'm not the best at coding and the fact that we're just thrown in with pandas, seaborn, and other packages, I'm not used to it, and it has been a year since I've taken a coding class so I feel lost and extremely stuck most of the time. Content will be mentioned during lecture and I understand it but it doesn't stick... then when it comes to applying it with assignments (labs specifically), I feel extremely stuck. And sometimes hopeless (if I'm being honest). 

Moreover, when it comes to labs, I have a hard time understanding certain prompts and what it asks of me (but that could just be a personal problem, who knows)",,,,,
"I have liked the group project aspect so far. While I am usually not a fan of group projects, my group works well together, and we are able to complete things well and in a timely manner. It is nice to have a good collaborative experience since unfortunately this is not always the case.","The labs and assignments often reference or require things not covered in lecture. While I understand prior knowledge of programming is expected, it would be nice to see some more methods/topics mentioned. There were a few times I would wonder if I was ""supposed to"" or ""allowed to"" use a certain method since it was not covered.",,,,,
I have enjoyed graphing the given datasets in the assignments.,I don't really like how all the assignments are due on the same day.,,,,,
Doing the discussion assignments is really fun! I love NumPy!,"Nothing really, its a great course!",,,,,
"Dataframe operations. Personally, I love learning about organizing data.","Interpretation of data. It's just that analyzing the data sometimes has some pretty strange results, so maybe I need to learn more about statistics.",,,,,
python and pandas review,"multiple different assignments, would be easy to miss an assignment if i'm not careful",,,,,
I like the discussions and how it feels to work through them. I feel like I'm gaining familiarity with the content. I've worked with pandas before and I like the discussions for getting me back into the groove.,"Not really anything, I think it's been good.",,,,,
"As someone who has exposure to research, I find the higher level concept very interesting (ex. domain expertise, data collection & cleaning, ethic).","I don't necessary dislike anything but I find the length of assignments are a bit long which might not be necessary to promote learning. Although it is completely understandable for the assignments to be broken down into step by step, having too many of them took away the motivation for me to explore and test on my own. By the end of the assignment, I just wanted to move on. To be fair, I always try to finish them in 1 sitting which might not be what the assignment intended to be. Having multiple smaller assignment might helps (ex. pre-lecture, post-lecture)?",,,,,
Learning about libraries in Python that help understand data.,"Some members in team project do not participate or communicate, leaving me and other members to complete the work.",,,,,
"I like the structure of the class, what is being learned/tested is always clear and digestible.",Nothing really.,,,,,
I have enjoyed the real world application of the labs and assignments so far.,"My project group seemed sort of uninterested when we met last time, so the final project might be more difficult than expected.",,,,,
The lectures are interesting and I like how there are many examples provided within the lectures.,"So far, everything is fine to me!",,,,,
"The lectures are captivating and learning about how to use pandas, seaborn, and overall data science techniques/libraries is very useful to know, even though I don't plan to go into data science.",D3 was fairly difficult and I feel like would have been nearly impossible if I was not able to make it to a lab that week.,,,,,
"Data Sci, because we can find a lot thorugh the data.",NA,,,,,
I am really enjoying discussing with the group for the group project since all of our group seems to be motivated.,Don't have any least favorite thing about the class. Every activities or PA seems to be reasonable and good practice for the final project.,,,,,
Being able to search around and find a unique/interesting research question,"Nothing, everything has been really interesting and more importantly practical",,,,,
learning python,would have been nice to have lectures online during rain,,,,,
Not having a midterm,Attendance in class?,,,,,
Learning about how to wrangle data and get meaning out of it has been interesting. It is a very helpful skill to use,"Sometimes it can be hard to understand how to get the intended output in labs and assignments, but it is expected and I can always go to lab hours if needed.",,,,,
I've really enjoyed doing the discussion assignments. I've been learning a lot through them and looking over the notebooks from class lectures has given me a good starting point.,There's nothing that immediately comes to mind and I appreciate how flexible the professor is with the attendance policy. I was wondering if the discussion section slides or tips are shared anywhere if we can't make it to one of them.,,,,,
I enjoyed learning different types of plot to show the data effectively. Also I liked that I could practice using those plots in lab and assignments.,I am not sure why things covered in guest lecture appears on the weekly quiz. I thought guest lectures are extra credit.,,,,,
I like how the class teaches the intuition behind data science in parallel with the techniques.,I dislike how the project based portion of the class occurs outside of class time. It feels like it's harder to work at the same time as a group.,,,,,
One thing that I enjoyed is how we use existed data to make graphs and then analyze them,"data set up process, I think it's boring",,,,,
Coding. I feel it would be helpful for my career.,Everything is nice so far.,,,,,
Getting exposure to different Python libraries for data science,"There are a lot of smaller assignments to keep track of (e.g., quiz, lab, assignment, group project), so it could be nice to combine some into one submission",,,,,
Recap a lot of Python skills while struggling with Java.,Not really.,,,,,
"The guest speaker, as I am a data science major most of the content has not been new for me so far, but I have enjoyed listening to the guest speaker and his experience in the industry.","The assigned groups for the project, I understand that the experience working with people we do not know can be useful but I was hoping to work with people I am anticipating on working with for my DSC capstone sequence to see how I like working with them. Also the differing skill levels in terms of coding does make me a little nervous as to how the project is going to go.",,,,,
I have enjoyed doing the assignments because it's hard for me to grasp the material until I do it myself.,It's kind of difficult to have everything due at once but it does make it easier to remember the deadline.,,,,,
I've enjoyed visualizing data.,I dislike that instructions are not specific.,,,,,
Learning about pandas and seaborn seems pretty useful.,I just generally dislike group projects.,,,,,
I think the content is interesting and the lectures have been helpful when I've been able to attend.,"Nothing too extreme, but some of the assignments seem to run a little long and the instructions aren't always very clear for them. Not a major concern but would probably be my least.",,,,,
"The guest talk was very insightful, as it showed me how the skills I learned in COGS 108 can be translated into the industry.",It would be nice if the instructions in the assignments could be more detailed.,,,,,
I love the interactive Jupyter Notebooks and graphics. I like how the code outputs results and explains them in a readable format.,I do not like having to pay for an iclicker.,,,,,
The quizzes,The pace is a bit slow,,,,,
Project should be fun hopefully,So many assignments paired with stricter late policies and grading for correctness and over strict grading scheme. Lots to juggle,,,,,
I have enjoyed constructing plots to make observations about the nature of a set of data the most. Making conclusions from the input data has been very interesting.,"My least favorite part of the class so far has been the some of the pandas/numpy documentation that i have head to read through online . A lot of this documentation does not have examples so it is a bit hard to completely understand what each method does at first glance. This no fault of the class, but it has been my least favorite part of doing the class.",,,,,
I liked learning version control for real world industry experience.,I don't like the quizzes due on sundays.,,,,,
I have enjoyed the assignments and labs because they are very interactive and allow me to learn,I have least liked the lectures because sometimes I find it hard to always pay attention and that they are a little slow and not focused on programming,,,,,
Interactive assignments,None,,,,,
"The interactive nature of the lectures, and getting to apply concepts through the discussion and assignments.","It can be hard to get comfortable and in a working relationship with the group, especially in the time frame and manner approached in this class. It would have been nice to have known the groups earlier, or had some more organized or structured way of forcing groups to meet.",,,,,
I have enjoyed the coding assignments and learning about data wrangling. I think that data wrangling is very important in the real world and I enjoy learning about the different ways in which to look and interpret data.,"Scheduling with group and trying to get everyone on the same page. I think this is just the nature of working with others and trying to get the project started, but personally it is somewhat frustrating trying to schedule and get a hold of everyone with little effort given back.",,,,,
Learning about using data science software,I would prefer if quizzes were released after the 9:00am lecture,,,,,
"I have enjoyed learning about various visualization principles of data analysis and how to improve my thought process during the data science project pipeline in areas, such as ethics.","It would be great for the group project to not be randomly assigned but rather determined by skillset, so each team would have a couple people who know how to code, others who are more creative, etc.",,,,,
I like the setup of the project.,Wish we learnt more about statistical methods that can be used,,,,,
"I really like digging through documentation to learn about libraries, I feel that it's really fun to iterate through different methods of going about manipulating data and it's really satisfying when what you wanted to accomplish finally works","I feel that a portion of the assignments have code written for us and is often confusing to understand what it actually does without struggling with it for awhile, I especially wish that we had more practice with data acquisition and cleaning as it's done for us.",,,,,
The data wrangling and manipulation as well as the coding,N/A,,,,,
I loved learning about pandas and dataframes. I think Jupyter Notebook and pandas are very powerful tools for data visualization and these are both technologies that I haven't worked with before.,I think the project groups should've been formed earlier so we can get started earlier and have more time to finish.,,,,,
Applying the basic concept from COGS 9 and managing dataset in coding is fun!,Comparatively concept heavy material is my least favorite as I enjoy learning more actively learning required material like playing around with datasets or generating figures.,,,,,
I've enjoyed the assignments because they're structured in such a way that I can learn data science skills through the completion of them,The group project as I don't like working in assigned groups as it can lead to a mismatch in skills and more importantly effort levels.,,,,,
I've enjoyed the lectures. I think they are entertaining and easily digestible.,"I am generally struggling with assignments, but that could just be a me thing. I am used to having programming classes where there are tutor hours that I can go to for debugging rather than having labs. Unfortunately, I mostly only have time to get most of my work done on the weekend and it feels scary to not have a synchronous help option then. Also, am used to pair programming more, so maybe that's why I'm struggling more.",,,,,
Working on a team,Some of the instructions for assignments can't be a bit unclear sometimes. There are so many ways to do one problem,,,,,
Getting more experience with Pandas. I have enjoyed the assignments and love solving coding problems.,"The group project feels like it has gone from 0 to 100 really quickly. Half of our group had not met or contributed anything until our meeting three days ago, so the pace that we will need to keep for this project worries me.",,,,,
"I really enjoy working through the assignments, I feel like I learn so much about python and data science",I did feel a little intimidated by some of the projects we reviewed and their code,,,,,
Group working with my fellow group-mates.,Quizzes.,,,,,
I really enjoyed learning about various tools we can use in data science such as the various python libraries. I also enjoyed learning about how to make informative and professional data visualizations.,So far nothing stands out particularly. I don't enjoy group projects that much but I think its good practice working with a group.,,,,,
I enjoyed learning about how to use pandas and data visualizations because those concepts are very applicable to my summer internship as a business analyst.,"I like least about the random assignment of groups for the final project because before working together effectively, it takes time to get to know each other and everyone's working style. Although it is a good opportunity for me to step out of my comfort zone, working with people I'm less familiar with takes me more time to produce a high-quality result with my team.",,,,,
"The organization of assignments, discussions, etc.",The amount of redundancy in coding.,,,,,
Welcoming lecture and helpful staff.,A little confusion with some homework problems.,,,,,
It's been fun to review python since its been a bit and apply it to a question my group came up with.,I don't have anything I particularly dislike.,,,,,
I like the assignments! I feel like Im learning about python which Ive never used before!,"The group project feels daunting. But, I also am excited to hopefully have something cool to put on my resume, so I don't feel awful. It's just a bit anxiety provoking.",,,,,
"Understanding the process behind data science. I like learning about why we do certain things beforehand, the implications of data science projects, etc.",The actual coding part. It all goes through one ear out the other.,,,,,
I have enjoyed doing the coding labs as I find them to be very stress free and learn from them,I have least liked the group projects as I'm not a huge fan of group work in general. It can be hard at times to find matching schedules and be constantly in communication with everyone,,,,,
Working with different people that I do not know before on some things that we all like in common.,"The class is too early in the morning, sometime it is hard to make it to the class.",,,,,
working with pandas and data wrangling,"datahub/juypter notebook, it can act up sometimes",,,,,
"Lectures about data used in real-world examples, ""stories"" about data, and the guest lecture.","Using Github, Github desktop, etc.

Every aspect of the class is nice except using Github and cloning, pushing, pulling, committing, etc.",,,,,
"Yes. I think the topics covered so far in class are pretty interesting such as different methods for data visualization, useful methods in pandas etc.",Nothing I don't like so far(maybe the 9:00 AM lecture lol coz I have to get up early),,,,,
I enjoy reading the previous projects. I saw a lot of interesting topics and those inspired me a lot.,I think so far everything is good.,,,,,
I have liked the the jupyter notebook and assignments because they are quite useful and conducive to my learning. I also like that there are quite a few EC opportunities,There's not really anything I haven't liked,,,,,
I definitely have enjoyed learning about the data science process and formulating a data science project for the final project.,"Too many assignments each week, I wish we could've combined some assignments to make it easier to keep track of what I need to complete on a week to week basis.",,,,,
Learning about the concepts on how to make visualizations and using data using code has been the most enjoyable part of this course.,"I don't like how much work there is, especially with the amount of assignments that are piled on for this class (i.e. having to do all discussion labs and assignments and quizzes in a week). Also, I don't like having assigned groups when there are people who aren't responsive and don't take responsibility because it feels hopeless in what to do when people don't want to pull their weight.",,,,,
I've really enjoyed applying what I've learned in lecture into actual assignments and seeing myself become more confident with data visualizations,"I think I would have preferred picking groups for the final project over being assigned random groups, but my group is still really nice",,,,,
"How it is diversifying my idea of working with data. I am used to just coding and working with datasets, but I never learned anything else about how to work with data. Being able to see what makes a data set good and how to ask questions has been enjoyable to learn.",Finding time to meet up with my group. I feel like because everyone has their own lives and sleeping schedules/ work schedules it is sometimes difficult to allocate time to work on the projects. Also because our meetings tend to last longer than expected so it cuts into all of our other plans.,,,,,
I think the project aspect - I got a great group and we are working on an interesting topic!,The weekly labs - they feel a bit tedious to get through.,,,,,
I enjoyed learning about what each graph type is used for,the lecture content does not help in completing the lsbs and assignments,,,,,
Probably the assignments because I enjoy applying our learning and using it to work on the assignments,"Nothing so far, I feel like I have enjoyed everything about COGS 108 as of right now",,,,,
I have enjoyed doing the clicker questions. They have been engaging.,I am not really sure what I least like so far.,,,,,
The labs and assignment are interesting to complete,Everything is great so far,,,,,
The Discussion labs are very engaging.,"In person attendance being part of a grade is difficult for me as I live a few cities away in SD county, so I'm just taking the loss of percentage to save on money haha.",,,,,
"I enjoyed learning more about data in general, and what exactly can be done to make data easily digestible for people.",Trying to teach myself python at the same time. I feel like I'm always behind and much of the work takes a lot of studying and referencing other sources to figure out what's going on - but this is due to me not knowing Python.,,,,,
I like the pace of this class. It's very decently paced as opposed to DSC 10.,There are two assignments and a quiz due every week.,,,,,
Able to use what we learned in this class and before in python to really work out a data science baed project.,Working with random group members on big projects. It is difficult to communicate sometimes and wok together as we don't know each other before.,,,,,
I enjoyed doing python because it is a really useful tool and we could use this in our work.,"I don't like the theoretical part because theoretical stuff is hard for me to understand. But I understand that it's necessary for the class to help us understand data science in many perspectives, not just about data.",,,,,
"I've enjoyed Discussions and Assignments so far, as they have helped me understand the material better for this semester.","So far, group communication and planning for the project has not been great, as some of my group members have not been engaged with the process so far.",,,,,
The thing I liked the most about COGS 108 so far has been learning how to manipulate data to make it easier to visualize and use.,"I don't think I have anything that I dislike about COGS 108, I enjoy all of the class.",,,,,
