enjoyed_most,enjoyed_least,,,,,
"The pace is moderate, easy to follow but not boring.","We have to work in a group. personally speaking, I dont like group projects",,,,,
I enjoy exploring data science more using Python.,"I don't really like when labs, lecture, and assignments are released and students can't run the code without errors popping up. For many who are not familiar with Python, it is hard to figure out these error messages. A lot of the lab code especially always has errors.",,,,,
"guest lectures, being able to hear real life experiences is helpful",weekly lecture quizzes,,,,,
"Assignment, there is a step by step guide how to finish the assignment. By just doing the assignments, I gain decent knowledge","Assignment, because its also time consuming.",,,,,
Coding,Group members not responding,,,,,
I enjoyed the guest lecture. Hearing about other's path to data science and associated reflections is very helpful.,"The assignments are very hard for me. I am new to git, github, & jupytr notebooks so all the jargon, syntax, folders, etc.. is overwhelming and intimidating.",,,,,
learning more about data visualization,Some weeks having both discussion and an assignment due,,,,,
I enjoy challenging myself on exploring Pandas and reinforcing my coding skills,I sometimes have difficulty with the D & A Assignements,,,,,
I like the relaxed nature of the class overall and how the assignments are meant to be too stressful but rather for learning,The weekly quizzes are rather time consuming and don't really reflect the course material learnt that well sometimes,,,,,
I enjoyed the guest lecture the most because it brought insight into the industry.,I do not like the weekly quizzes because they are timed.,,,,,
Working towards the project,The quizzes are a bit too unrelated imo,,,,,
I really like doing projects and doing data analysis.,I don’t like being assigned to a group because I cannot work on group projects with my friends.,,,,,
I've had a great revision go Python,Too much introduction to python,,,,,
"I like learning about the different coding avenues (pandas, seaborn, etc). I like graphing the data the most.","I haven’t really not liked anything, although it was hard to do the previous project review and understand someone else’s code at times (maybe because we haven’t learned all the different techniques yet)",,,,,
I like listening in lecture.,"I don't really like Python, because I feel like the only thing I'm doing for the homework is finding the right function.",,,,,
I have enjoyed the discussions the best as they are a good summary/practice of what was covered throughout the week,COGS 108 has been fun! The only thing I don't like is how early the class is :( (and I have a conflict with the 2pm section so I cant go to that one),,,,,
"Learning about data science, and how to solve an interesting data science problem.","Need to walk at least 15 minute from my apartment to the classroom, especially during the raining day, I know it isn't actually related to the class, but other than that, everything is fine.",,,,,
It's my first python class so I've enjoyed learning and actually coding in python,I tam not really enjoying pandas. I know the class is all in pandas but there's a lot of syntax behind it and I'm having a hard time understanding the parameters and the order to do things.,,,,,
"Learning about data science, initially I thought it would really challenging since I am not that knowledgable with coding but I actually have a lot of fun doing the assignments and learning about topics within data science.","Since this is the first time I'm learning about data science, I wouldn't know I don't like this but I struggling with learning how to use pandas and wrangling since there are a lot of different functions and codes, and it gets pretty confusing.",,,,,
Learning Python and using pandas to manipulate large data sets,"The lack of direction with the projects. This might be my own doing, however, I am slightly confused about this whole process.",,,,,
"So far, I have enjoyed the labs in COGS 108. I am new to Python, and the Discussion Lab Assignments really help me to learn the different functions and syntax. The structure of the labs and the guidance they provide are really effective at teaching how to code in Python.","So far, I have least liked the Assignments, because of the hidden tests. I feel I am doing the assignment right and understanding the code, but then when I receive my grade, it does not match up with what I thought. I understand the hidden tests raise the stakes of the assignments and are there for a reason, but I feel as though I learn best from the discussion labs, which do not have any hidden tests and you have a clear understanding of whether or not you are coding properly.",,,,,
I've enjoyed the labs as they are straight forward and also have really good guidance before each question. Thank you for all the extra credit options as well.,"I've disliked the frequency of assignments (I also feel like the actual Assignments are quite lengthy in nature), and this can be tough to manage with midterm schedules of other classes. I wish we had more ""late/slip"" days.",,,,,
Learning more about python. I knew the basics of the language but I mainly code using Java. The course is really helping me strengthen my skills in this language.,The group I have for the project. Not all members communicate effectively and contribute the same amount so its a bit concerning.,,,,,
I like when the professor discusses ethics in data science.,My team hasn’t been the easiest to work with so far. I also wish there were more office hours.,,,,,
I think the assignments have been pretty fun and a good balance between time spent and concepts tested. I've found myself thinking pretty thoroughly about them without feeling like I'm doing busywork.,"It would've been nice to pick our own groups, since this might make project planning easier and give us a chance to find a group with similar interests and skills. But, I have no complaints about my group.",,,,,
I enjoy learning about how data impacts people and that we are working to a practical project,The programming assignment and discussion assignments have coding portion that we do not go over in class. It would be nice to have more review and time to spend on learning the syntax of pandas and seaborn.,,,,,
Expanding my knowledge of Data Analysis practices and the novel mindset that Data Scientists use. As an aspiring Epidemiologist I find such strategies and skills valuable and fascinating.,"The emphasis in lecture seems somewhat disproportionate: while the class does acknowledge a certain level of familiarity in Python it still seems strange we quickly rush over code for various table manipulating tools but spend half a class on the differences between histograms, bar plots and other graphs.",,,,,
"The data visualization part. I really liked how we can use python to draw diagrams and visually present data. I also liked the tasks that we had to do in A2 and D3, where we were using diagrams of data to answer specific questions.","As a beginner to programming and coding, I thought that sometimes it’s quite confusing what each syntax means and sometimes I don’t understand why I have errors when running codes.",,,,,
Learning about Data Science and using Python to analyze data because I think these are very useful skills to have and will be important for my future career.,The thing I liked least about this course so far is that we have to submit work on datahub since I don't think the UI is very intuitive and can be confusing at times.,,,,,
I don't really enjoy coding.,What I've least liked about COGS 108 is the entire course.,,,,,
I enjoyed just getting to know how to use pandas and seaborn. It's pretty neat and I like finally getting to know exactly what data science means.,"My least favorite thing was when I was doing D3, I wasn't aware I should have done A2 first and I struggled a lot more than I should have.",,,,,
"More practice using pandas functions! In my upper div DSC courses, we don't really do this anymore and I missed what I somewhat missed what I did in DSC 10 and DSC 80.","Data visualization week was very repetitive of DSC 106, but it definitely is necessary to understand how to make visualizations and what makes them ""good"" or ""bad"".",,,,,
I've enjoyed doing the assignments because they're good practice for skills I think I'll need.,I've liked the 9am class time the least because I don't like getting up early.,,,,,
I enjoyed the assignments because they helped review my knowledge of python/,Sometimes I do not like the lack of instruction on the labs because I'm not sure if I am doing it right (but I feel like that's the point).,,,,,
"weekly discussion, really good remind what we learned from the class","everything good, but when i use data hub, sometimes it's really slow.",,,,,
"i like that we're working on a real project, because if we do a good job, we can use it for our portfolio.",i think the pace for the project is a little fast,,,,,
"wrangling data with pandas, there is just so many things I can do and I learned a lot.","plots, since they are not fixed (meaning you can have multiple answers) and I'm not familiar with it.",,,,,
Labs,Assignments,,,,,
How organized the class set up is and having abundant of materials making finding for materials very easily. Professor Ellis is also very caring and understanding which making the overall experience more enjoyable.,The Assignment or Lab instruction can be a little bit open ended which make doing the assignment a little bit confusing of what the expectation would be.,,,,,
The thing I have enjoyed most about this course so far are the clicker questions. This is because I have to take a step back and actually think and process the information I learned during class.,What I like least so far about Cogs 108 are the labs. I think the labs have been much more difficult compare to the assignments.,,,,,
Getting know more about data analysis.,Nothing.,,,,,
"I like that there is the option to attend class in person or remotely through podcast, as it makes it easier for a commuter like me if I can't attend class in person for some reason. I also like that grading mistakes are fixed very quickly, as it reduces anxiety about my grades.",I'm aware that this isn't like an intro data science class but I did not expect to jump right into learning about it and only briefly going over python basics (I took COGS 18 last year so it wasn't exactly fresh in my mind).,,,,,
learning how to code! and generating plots,i don't know what kind of question to ask for final project and everything cramped in midterm season,,,,,
"I enjoy lectures in Cogs 108. I think the professor is a good lecturer. It sort of feels like review for me, as a Data Science major, but I feel that it is still useful. The GitHub lecture/information is really great and fun to learn about. I also like talking to my peers in lecture. It is really nice to either complain together or simply learn about other. I actually made friends with those who come to class often, and it makes me happy.","The assigned group projects and lab/assignment directions. I have hesitations around group projects and even more-so when I do not know the other group. Mine has been a bit difficult, but the Professor has been helping me as the quarter continues, so I think it will get better. The lab directions and the assignment directions are often unclear. I feel like a lot of the time I am guessing as to what the directions want from me. I feel like the wording could be a bit more clear. If I have to look at multiple sections of the problem to figure out what they might want, then I think there is room for improvement.",,,,,
"I've enjoyed how engaging the course is, having variety of assignments like discussion, being a more open type of class",So far something that I least liked is the communication within the group.,,,,,
assignments are easy and fun to do,the quizzes should have another attempt,,,,,
I enjoyed using jupyter hub in order to code graphs and basic functions.,I disliked the complicated commands that is used on making bar graphs/sea plots,,,,,
I enjoyed working on the assignments in this class. The project so far is also going well.,I have no complaints for this class.,,,,,
Many might consider COGS108 as simple but it is perfect for people like me as a beginner who knows nothing yet.,the assignment and discussion is more time consuming than I expected. I expected 2 hours for A2 but actually I spent 5 hours since i was very new to everything. For D3 I spent about 4 hours to double check the answer and make sure I understand the prompt correctly. Some of the D3 instruction is not clear enough.,,,,,
"Learning about various aspects of data science is the part that I enjoyed the most in Cogs 108. It gives added directionality to what I can do with Python moving forward. Although I don't aspire to be a data scientist, the concepts I learn from this course such as data wrangling data, creating plots and being mindful of ethics/data privacy can go a long way in any career. I also enjoy attending lectures since there is never a dull moment.",Mostly the lack of passion and communication for Cogs 108 Project which is expected given the randomized assignment of members. It is very difficult to light a fire under people who see this class as a check in the box. I also feel separated from potentially meeting others who are genuinely excited in doing something interesting. This gives me further insight of why talent management and team cohesion are so important.,,,,,
I enjoy the assignments,I think the quizzes are a pain,,,,,
I am enjoying using python because the only other experience I had was in Java,Difficulty in planning with groups,,,,,
The Professor explains the topics so clearly and concisely especially for people who are not familiar with data science or coding in general. The clicker questions are so helpful in reinforcing my understanding of the topics that are being covered and they help me stay engaged so that I know how to answer the question. It also helps me to interact with the people around me and ask for help or their understanding if I don't know how to go about answering a question.,"The project isn't explained very well at the beginning of the quarter. I feel like we have a rough idea of what to do but for people that are not familiar with the subject I think it would be nice in the future to have like half a class for instance discussing what the project will look like, a good example and the feedback the professor gives, and time for the students to ask the professor questions about the topic.",,,,,
We get to try a lot of data science tools in practice through assignments and discussions.,"The due date being Sunday has been very stressful for me personally. I’m part of a competitive dance team on campus, and have had competitions on weekends, making the Sunday night due date for everything difficult to make. It has definitely impacted my performance on the assignments, as I missed small things that were caught by hidden tests later. In the future, I think Monday night, would be a better option. That way we have the weekend to work and, in the worst case scenario, get last minute help on Monday before submitting.",,,,,
class isnt very stressful,discussions are harder than assignments,,,,,
learn pandas in python,the assignment instructions sometimes seem to be confusing,,,,,
I enjoy the freedom we have with deciding on our topic.,"Learning to code is difficult right now. I took COGS 18 and have other programming experiences using python. However, I have very little experience with stats and found it difficult to understand the documentation for Seaborn. More clarification on how the syntax works would be helpful.",,,,,
I have enjoyed practicing pandas and I look forward working with my group.,N/A,,,,,
The assignments are interesting,It’s a bit confusing seeing which assignments I have done and submitted. In general keeping track of assignments,,,,,
"So far, it has been an interesting yet challenging class as I am not the best at python or coding in general. The lectures have been engaging especially with the iClicker questions.","Sometimes it may not be completely helpful when I am trying to look back while trying to complete the discussion labs and assignments. That is usually ok because then I would try to search it up on Google, but it can be somewhat frustrating to do so.",,,,,
Learning how to use imports like pandas and numpy,"Not being able to choose teams, but its not that big a deal",,,,,
"I enjoy how the lectures tie in application to the real world! I feel that a lot of courses I take never make the extended relationship to how we or others might use course concepts in the field. I also really appreciated the walkthrough format of A2 because as someone who has never coded with Python before, it was nice to have a more formal and guided introduction to common functions and strategies.","I did not like how D3 was much more difficult compared to A2, as I would have expected the main assignment (A2) to be harder than the lab assignment (D3). However, I usually complete D# before A#, and I wish that the D#'s could be formatted in a more guided walkthrough.",,,,,
Gaining a better understanding for pandas and data visualization because I believe it is an important asset.,"I would like the labs for the discussion assignments to give more specific instructions on what functions we should be using to complete the question. Sometimes, it asks us to do something that we have never done before without giving us the library function that we need to use to answer the question.",,,,,
"I've enjoyed the labs and assignments, I think they are fun and I have learned some new things from them.","I've least enjoyed the quizzes, they also feel tedious, but they don't take long so it's not a huge issue.",,,,,
"It's been a relaxing, not too stressful class. The content is new and fun to learn about since I haven't taken a data science class previously.","Accessibility to get help. Probably towards getting help on assignments or discussion work. All I know of are my lab hours, but usually I take up the entire time completing the discussion assignment. Also it was a bit difficult to coordinate good timings with my team, which is out of control of the course and staff of course, but that was a small issue.",,,,,
"Learning about plotting graphs, because seeing the graphs gives me a clearer sense of what I'm learning and a sense of achievement.","Struggled with the assignment. Because I have a really poor coding background, I needed to look up a lot of things online. However, this is my problem and I understand the course design, so this has nothing to do with the course.",,,,,
I like Dr.Ellis' explanations during lecture. She's a very good lecturer! Also the labs reflect what's taught in lectures.,"I guess the random group assignment. Although I know that it is often the case in real life that people from different background need to work together, it takes a lot more time to communicate between each other since we have different expectations and experience.",,,,,
"The assignments and labs. I feel like I learn a lot from them and they're equally challenging and fun, as well as interesting with the types of data we get to see. Definitely my favorite assignments I have ever had from any class.","Uncertainty about project, feeling stuck.",,,,,
To learn about the ethics behind data science. Because usually people just use the data without consider how they collected and processed the data. Understand the ethical fields of data science really impacted me a lot.,Everything is good so far.,,,,,
"I have enjoyed doing the assignments, because it has allowed me to apply the skills talked about in lecture. In addition, it really helps to remember and understand how to apply skills discussed.","Although there is nothing severe, there are certain parts of instructions that are often unclear.",,,,,
The labs are interactive and helps learn about the course.,Sometimes feel like there are too many assignments to keep track of.,,,,,
I've liked learning about different ways of displaying data and which visuals are most effective in displaying certain kinds of data,"I appreciate that we've gone over the basic concepts however I feel like so far what we've learned in class isn't aligning to the bigger scope of what we have to complete for our project. For example, our project proposal is due however I dont know how to go about deciding on a research question.",,,,,
"Love the discussion and assignment, pretty helpful for organizing the project",Don’t have too much communication with my group,,,,,
I like that the class accommodates those who can't make it to class in person. I also like the lecture format and the discussions are very helpful.,Datahub sometimes freezes or has trouble running.,,,,,
The lab homework,Nothing so far,,,,,
I have enjoyed my discussion sections where I get to collaborate with my classmates.,"I have disliked when my code doesn't run and I am stumped. But, it ends up ok!",,,,,
"Hands on experience in doing data science related tasks such as data cleaning, data visualization, EDA, etc and having a group projects to work on.",Weekly discussion is not that helpful for me since it just went over the discussion assignments.,,,,,
I actually really like doing the asingnments. They are fun and engaging. I also think that the material itself is very interesting and fun.,"Some of the questions on the datahub assignments are a bit confusing and unclear. Especially for the ones that require visualizations. If some of the questions could be a little more clear, it would be highly appreciated.",,,,,
I have enjoyed the lectures the most. The professor explains topics very clearly. I also liked the guest speaker session.,I found the last lab difficult and didn't enjoy doing it because it took a long time trying to figure out what worked and what package methods to use.,,,,,
I really enjoyed the lectures and figuring out the homeworks. The homework allows me to use the lectures and apply it there.,I feel like I like everything so far. Maybe the tests and hidden tests are hard to understand.,,,,,
The content in lecture is digestible and the pace works really well for me. I often don't need to look back on the slides after lecture because I understood the content during class.,Some of the discussion lab content can be much harder than the examples given in class. I would like to see more examples in general.,,,,,
I really enjoy how we make plots to visualize datas,So far I think the pase of the class overall is too slow.,,,,,
"The discussions, because the TAs in the Wednesday at 12 class gave helpful hints and tips.","The one Sunday that had a discussion, assignment, project review, and week quiz. It felt a little overwhelming.",,,,,
I enjoy leaning how to use pandas.,I like drawing plot the least.,,,,,
I have enjoyed learning how to use python to visual data. I have never used a coding language for data science and am happy I am starting to do so.,I have disliked not knowing the solutions to assignments and discussions after they have been graded. I believe I have gotten the right output for every assignment but I don't think my code was the optimal way to produce such result. I am new to pandas and seaborn and would like to know what the most efficient way to get the desired output.,,,,,
I've enjoyed learning different applications of data science and I appreciate the variety of fields covered in examples.,Sometimes the assignments/discussion assignments take a long time and there are kind of limited office hours.,,,,,
Using python and being exposed to more skills I can put on my LinkedIn,my friends stopped showing up to lecture :(.,,,,,
"I enjoy writing code and generating plots with python. Although it might be tricky sometimes, I always feel accomplished when I finished it.",One thing I liked the least about is the vague grading system. Sometimes I don't understand what the lab questions are asking for and what kinds of answers are accepted.,,,,,
I've enjoyed the coding aspect of this course. I feel like I'm actually learning how to engage with data science in a practical and marketable way.,"I feel that I have to do a lot of outside research to figure out how to do the assignments. I understand that any tech job requires a constant drive to learn and problem-solve, but it can be a bit frustrating when you're learning something fundamental for the first time.",,,,,
i've enjoyed the assignments,i feel like the class goes by really slowly but i think that's more on me,,,,,
The course content is interesting,NO detail about homework,,,,,
"I like the lectures, I really enjoyed it.",coming to session in R,,,,,
I like the weekly quiz because it summarizes some key points throughout the week. It enables me to review the slides afterwards if I felt confused on the question on the quiz.,"After reviewing past final projects, I felt a little bit stressed about the length and difficulty of the project (but overall felt excited).",,,,,
"learning how to use datahub, I code a lot as part of my major but I always enjoying learning new languages or programs.","communicating with my group has been a bit difficult, but I think it will be better from now on.",,,,,
"The theory behind data science, and interesting studies/example for how we come to understand data science.",Nothing so far!,,,,,
I like being able to learn python again and also using jupyter notebooks to learn pandas as well,I least liked the fact that the iclicker app required a subscription after the trial,,,,,
I enjoyed working on the assignments as it's my first class about data science and it's fun looking at datas.,none,,,,,
