response,most_least,quarter
"I'm a big fan of the structure of the course so far, it's the most ideal situation in the ongoing pandemic. Great Work Everyone.",1,fa20
I enjoyed learning the graphing techniques since we don't usually learn them from other classes,1,fa20
I like that every course material is on GitHub,1,fa20
"Learning new pandas functions, I knew python but I didn't know dataframes very well.",1,fa20
The lectures are super helpful and easy to follow,1,fa20
Learning how to do assignments by using google and lectures.,1,fa20
classes are organized,1,fa20
I have been enjoying the assignments and the project because I can practice what learned in lectures into real practices using programming. ,1,fa20
Learning how to analyze data using Pandas,1,fa20
"I really like the flexibility of the course and the relevance of the material. The lectures are very informative but not overwhelming, so I can easily understand the topics covered and why they are important to learn. ",1,fa20
Practical homework assignments,1,fa20
The interactive Python lessons are really helpful.,1,fa20
"Learning python, and how to apply this to real life situations!",1,fa20
I really like the concepts we learn and then applying them to the assignments,1,fa20
"The project concept, we have an idea to simulate baseball games to create data to compare to answer our question and I think that it will be exciting to develop.",1,fa20
The lecture style in broken up into pieces. I love it so much.,1,fa20
"The lectures do help with the assignments, and I like how they are clear and concise.",1,fa20
I enjoyed the PA the most because they have been teaching me the most about pandas and python,1,fa20
I have really enjoyed learning about Data Science as a whole. Learning about how to use the different pacakges,1,fa20
doing the jupyter notebooks to get hands on experience and also the advice about securing jobs,1,fa20
"having the mix of videos, quizzes, assignments, and EC",1,fa20
I've mostly enjoyed how this course has given me a new perspective on data and a greater appreciation for it. Each video and assignment has shown me how I can interact with data in order to answer an interesting data science question. I also really enjoy how we're going over inferential statistics this week because I love statistics. ,1,fa20
I've enjoyed learning about how you can gather information and sort through it to find different information like going through columns to find any null values and altering information in a way that helps me analyze it. I also like the pacing with the datahub assignments.,1,fa20
"I really appreciate the lectures. I mean this in the best way possible, but I love that the lectures are designed as if they are for elementary school kids :) - basic, from the foundation, and straight forward. A lot of classes at UCSD, even the intro classes, sometimes just assume that we know X amount of information. I've also had professor's explicitly say they don't care if we don't like the method in which they're presenting the lectures or they ""don't believe in visuals"", etc etc. I've found this class engaging, exciting, and encouraging. ",1,fa20
Brainstorming in a team setting,1,fa20
"I have enjoyed the homework assignments on Jupyter notebooks because they let me go at my own pace, and I can stop/resume at any time. I enjoy learning new techniques on how to access different parts of the data and how there's not only one way to do it correctly.",1,fa20
"the quizzes, because it keeps me on track , not letting me fall behind ",1,fa20
Learning about pandas ,1,fa20
"I like that the class is asynchronous, which is better for me since I can't wake up at 9am and I like to do things on my own pace.",1,fa20
"I enjoy being able to work collaboratively on a data science project because it provides hands-on experience with a topic we're interested in, which simulates what we would be doing in the workforce. ",1,fa20
how you kind of have to do a little digging during assignments since not everything you need to know is in the youtube videos or slides/jupyter notebook. ,1,fa20
Having to do quizzes daily (or weekly depending on how you complete them) keeps me on track and helps me not fall behind in the course,1,fa20
Learning Python and working with Pandas,1,fa20
The clear lectures and assignments which teaches me a lot about python. ,1,fa20
The slides,1,fa20
The lecture videos are often short and to the point!,1,fa20
being able to do jupyter notebooks alongside the lecture videos,1,fa20
I enjoyed learning how to use pandas. I think A2 is very interesting because it mixes coding with data visualization. ,1,fa20
I've really enjoyed the various different questions we're able to answer by gathering information and data. It's fascinating to see how information lets us learn more about a certain topic.,1,fa20
The lecture style,1,fa20
I've enjoyed learning how to use pandas.,1,fa20
The ability to watch lecture whenever throughout the week. Sometimes the flexibility helps.,1,fa20
learning python and I am planning to do my own research with my friend.,1,fa20
PAs. Quick and painless.,1,fa20
"Everything. How one goes about starting a data science project, learning the programming specifics (pandas, plotting, etc), how to ask specific questions, etc. ",1,fa20
Learning how to collect and modify data via python,1,fa20
the class is organized very well,1,fa20
The structure of Python being taught.,1,fa20
The thing I have enjoyed the most in COGS 108 is the structure of the lectures that allows for more flexibility in when we can watch and take the review quizzes.,1,fa20
"Simple straightforward quizzes, which make it less stressful for me to worry about this quarter, especially during a pandemic. Also the assignments I do like since they are more of a walk through that teaches you as you go.",1,fa20
The super organized structure of the class,1,fa20
Group meetings to work on the Final Project.,1,fa20
I enjoy learning about python and gaining the skills to do data analysis as I have never done it before but know it will be important skill to have as a Computer Science major. ,1,fa20
"Lecture quizzes are effective, easy, and student-friendly way to learn. Assignments are good balance of work and are pretty fun",1,fa20
Learning about the various packages and tools associated with Python that is available for use in data science projects.,1,fa20
I learned a lot about data analysis which I think is super helpful.,1,fa20
The format of this class is super flexible for me to learn data science. ,1,fa20
Learning about how code is so important nowadays and it is a great skill to have.,1,fa20
I have really enjoyed the data science examples we have used in class so far. In some cases I can see how doing these data science tasks can solve real world problems and I enjoy that the most.,1,fa20
"I've enjoyed learning the nuance of DS, like how to best present data, because my programming background is with the CS department where the courses are much more coding/data structures based ",1,fa20
I  enjoyed learning to write programs and performing data analysis using python on the datahub. ,1,fa20
"I enjoyed the way Professor designed the lecture materials. She first gave a big picture of data science and then go deep into details. I now have a brief idea of what does it like to do a research in data science. Before taking this class, I had no idea at all. ",1,fa20
Learning python,1,fa20
I've enjoyed getting to know the students in my group. They're really smart and interesting and it's nice to feel less alone in this class. ,1,fa20
hands on work with data visualization and data wrangling!,1,fa20
I think the project part,1,fa20
working with my group,1,fa20
I like how professor Ellis is very accommodating to all her students. She presents information concisely and facilitates learning. I also feel like my data visualization has improved.,1,fa20
working with partners about cleaning datasets and think about ways to structure them,1,fa20
I've enjoyed how much of the class has been taught through analyzing examples. ,1,fa20
"I'm a beginner in coding, so I like see the power of what python can do in terms of what we learn in our assignments.",1,fa20
I have enjoyed the coding assignments because I'm learning how to code pandas and learn about data science in the process.,1,fa20
Learning about Pandas and Data Science!  I've always been familiar in Python but never used any data analysis tools. ,1,fa20
I am enjoying the ability to do a project with a group the most. I also really appreciate the flexibility we have in terms of when to complete the quizzes.,1,fa20
Using datahub to see applications of the material we are learning,1,fa20
The assignments,1,fa20
I enjoy the pace of the class thus far. I enjoy how the class does not assume much prior knowledge despite the fact that it is possible many individuals joined the class with said prior knowledge.,1,fa20
"I really enjoy the introduction to Python, data science, and jupyter notebooks. As a computer science major, I have yet to take any data science courses, but I am aware computer science is heavily involved in data science and I am glad this class has introduced me to field to see if I enjoy it. As someone who has also never coded in Python before, I think its useful that I am being introduced to the language. Lastly, knowing of Jupyter Notebooks for so long, I am glad to finally be learning the tool.",1,fa20
structure and organization of the course,1,fa20
learning codes in Jupiter notebook ,1,fa20
The assignment part. I think it is great for practicing coding expertise ,1,fa20
I think this course is really useful since I learned how to use github and different ways to proceed informations.,1,fa20
I learned how to use github and how to process data using pandas which is very useful since I am in data science major.,1,fa20
every quiz and lecture are helpful and I enjoyed doing project a lot.,1,fa20
I really enjoyed the group project since I am able to interact with other students.,1,fa20
The jupyter notebooks they are very easy to interact with and I enjoy the coding we do on there.,1,fa20
"formulating a data science research question with my group, completing the assignments",1,fa20
I like that the lectures are posted before the weekend so that I can watch them over the weekend when I have more free time. ,1,fa20
"I know next to nothing about coding (save for writing loops and what I have so far learned in this class), and yet this class has already put the idea in my head of maybe wanting to be a data scientist. I enjoy the fact that the professor seems to have communicated the practice of data science effectively, and from the persuasive perspective of someone who enjoys doing it. Genuinely, thank you Professor Ellis for turning my most feared class of the quarter into my favorite one. ",1,fa20
the ease of doing lectures and quizzes,1,fa20
"Working with my group mates, this is my first time doing a data science project and it has been fun working with them and learning more",1,fa20
I like that we actually get to do hands on project with the class and apply the techniques we learned in class,1,fa20
"Python, interesting lectures and guest speaker, ",1,fa20
I have learned how to deal with data and that is amazing.,1,fa20
I really like the coding portion from the assignments,1,fa20
"I am enjoying the Python applications of what we're leaning about statistics. I've spent time learning about it in theory, but using it in practice is always cool to implement and see. I've done so before with Math 185 in R, but Python feels more approachable for most people so it's interesting to try it there.",1,fa20
"I've enjoyed learning about data viz and how to use it, especially with the different libraries.",1,fa20
Learning to use python libraries to be able to actually do practical data science projects. Using the libraries like pandas and seaborn have helped me in my familiarity with these packages and confidence in performing more data science projects in the future. ,1,fa20
Learning various data science packages in python and their applications. This courses lectures videos are by far the most succinct yet informational out of all my classes. ,1,fa20
Learning various data science packages in python and their applications. This courses lectures videos are by far the most succinct yet informational out of all my classes. ,1,fa20
Project work,1,fa20
The guest lecture,1,fa20
Cool visualizations of data.,1,fa20
"I have enjoyed the structure of this class. I love being able to take the quizzes and finish the programming assignments at my own pace, within reason.",1,fa20
"I have enjoyed doing actual hands on work in Jupyter with pandas and dataframe, especially coming from a background of little coding knowledge. ",1,fa20
"I think I've enjoyed getting a more hands on experience with the coding aspect of the class, even though it is kind of difficult. It gives me experience with Python that I think is valuable both in class and outside the class too. I do especially enjoy the take home quizzes that makes the class easier to engage with the material. ",1,fa20
i enjoy the teaching style and pace. short video draw my attention that i do not easily lose my interest on those topics and the quiz are helpful for learning knowledge,1,fa20
Assignment,1,fa20
Clear lecture vide,1,fa20
"I've enjoyed working with my group to navigate the details of our project. We are all new to data science, so the process of learning and researching has been fun. ",1,fa20
I really like learning about pandas dataframe and how to work efficiently with data,1,fa20
yes! The course content is useful and group project is fun!,1,fa20
The assignments are very useful for learning new skills.,1,fa20
the python programming,1,fa20
The structure of the lectures. Watching videos that are around 20 minutes is more bearable to watch than those that are over an hour long.,1,fa20
the class is organized very well,1,fa20
"The lectures, I like how they are broken down into small chunks for me to digest and understand",1,fa20
Learning about data wrangling and practicing it,1,fa20
"Excellent Lectures, clean and easy access to everything",1,fa20
"Doing the group project because its a data science class, its interesting to work together on the specific question we want to answer.",1,fa20
Learning about constructing straight-forward data frame and carrying out analysis using graphs ,1,fa20
Learning how to use data science packages in depth,1,fa20
I enjoyed the project proposal. It was interesting delving into a data science question in that way.,1,fa20
I enjoyed to learn the new Python libraries like pandas. I think it will help me in the future in my Data Science projects.,1,fa20
I really like the asynchronous aspect of the course.,1,fa20
"Yes. I found COGS 108 is very helpful for my future career, and I can handle most of the materials of it.",1,fa20
The coding assignments. I appreciate how detailed the instructions and its clearly states what it wants us to do.,1,fa20
Experiencing the life of  a data scientist. It is a career that I am interested in.,1,fa20
The most interesting part of learning in COGS 108 is how much of can be applied to the real world problems. ,1,fa20
"The assignments, they are the hands on portion of what we learn in lecture",1,fa20
Learning Python is pretty interesting since I never thought of creating high-quality graphs from coding. ,1,fa20
"I like that the prerecorded videos are clear, concise, and edited down to the important points. ",1,fa20
Self-paced lectures,1,fa20
I enjoy deciding different kinds of graphs to use with different kinds of data. ,1,fa20
I love your lectures and how they are broken down. They are super informative and I don't fine myself loosing focus when I am watching them!,1,fa20
The bottom-up approach that assignments take in testing the material. I like how each assignment builds up to a large result (ie A3 with the final graph with linreg plotted).,1,fa20
The quizzes after each lecture allow me to truly see whether or not I understand the material that was taught in each video,1,fa20
The homework assigments,1,fa20
I enjoyed learning about data science techniques,1,fa20
Jupyter notebook is so exciting!,1,fa20
Learning how to use jupyter,1,fa20
the freedom to podcast whenever,1,fa20
I enjoy how informative the videos are,1,fa20
"What is a Data Analysis, how the data should be gathered before starting everything, how data should be prepared change my previous understanding of data science.",1,fa20
What I have enjoyed most about COGS 108 is how learning in this class is not impeded by natural instinct or talent in statistics or programming. Having the actual curiosity itself lends itself as a gateway to solving the problems when you are allowed to google things to experiment with and you have output to verify if your findings align with what is asked.,1,fa20
I enjoy the use of code in order to interpret and clean up data. I never knew that there were so many useful functions from programs like pandas and numpy that could streamline so many things.,1,fa20
Guest lecture! Vivian Peng is awesome!!!,1,fa20
The data visualization and tools have proven to be very useful. I am currently interning at Qualcomm and I immediately apply the knowledge I use in my work. ,1,fa20
Relatively clear expectations and well formatted lectures,1,fa20
"I enjoyed all the lessons on python coding, I know the point of this class is data analysis and not coding, but I really like coding. I also really like the way quizzes and videos are cut into chunks.",1,fa20
learning pandas. I think pandas would be useful in the future,1,fa20
Course video. Really help understand materials while maximize flexibility,1,fa20
the examples in class,1,fa20
"The homework, which gives very specific instructions and familiarizes me with the pandas package.",1,fa20
"I enjoy the lectures because although I'm not a Data Science major, it's always been something I've interested in, so it's cool to get exposed to this stuff!",1,fa20
Learning about and working with tools for data science. I've never done data science before so I enjoy working with pandas and analyzing data,1,fa20
The fact that it's in Python and we get to work on a project on our own. I love my team's project idea and I think it has motivated me to spend a lot of my off time writing code for it. ,1,fa20
I enjoyed the assignments and the office hours the most. I love how tutors explain the material so well to me and I hope it was more office hours or some 1-1 sessions. ,1,fa20
I have enjoyed the lectures about data visualization and things to be careful about. I had no idea how important this aspect of data science is.,1,fa20
The content I have learned in this course is really practical and useful.,1,fa20
"coding assignments, they're really fun to do because I feel like I'm applying the knowledge that I learned from class ",1,fa20
the good lectures and style of teaching,1,fa20
I have enjoyed some of the lectures. I think they are interesting and informative. ,1,fa20
The most interesting part of learning in COGS 108 is how much of can be applied to the real world problems. ,1,fa20
I actually like the Jupyter Notebook Python assignments as a way to learn about python and panda as I have no previous experience with the language,1,fa20
"I love the new topics we cover every week, and they're applicability in our data science project",1,fa20
The assignments are structured in a way that I actually learn the information asked,1,fa20
"Learning how to work with data using Python; lectures, including the guest speaker",1,fa20
the short videos every week ,1,fa20
"How the class is formatted, with no exams and lectures are videos that we can watch on our own time. I like these aspects because I feel less pressured to know everything in the course but am still actively learning.",1,fa20
I really enjoy the assignments. I find them challenging and fun to work on. ,1,fa20
The homework data were interesting. I didn't know tootsie roll was both fruity and chocolaty.,1,fa20
The fun and practical approach towards learning.,1,fa20
"The mini quizzes and the length of the short videos, but its rich, easily absorbable content. ",1,fa20
The videos and homework are clear,1,fa20
Python,1,fa20
"What I have enjoyed the most about COGS 108 so far are the lecture videos. They take less time than expected to complete, and are split up in a way so that I can take a break in between sets of videos.",1,fa20
Expanding my perspective on all the different things you can do with data and just how powerful and life-changing data can be. ,1,fa20
"the python, learning about what makes a data set good, what makes it bad.",1,fa20
it's more practical,1,fa20
"The assignments are very intuitive and basic and provide me with basic understanding of pandas and all the functionality that will be beneficial for a successful project. Therefore, I have enjoyed the assignments a lot.",1,fa20
"I honestly really liked the podcast-interview styled guest lecture with Vivian Peng. It was good to see the trajectory of someone's career (academic or otherwise) and how that related to data science, as well as having a few examples of how creativity and data science meet.",1,fa20
I like how there is a proper structure to the course.,1,fa20
Python basics.,1,fa20
I enjoy most on the material that is on the videos because they are very encouraging and interesting. The videos are where I learn the most. ,1,fa20
I have enjoyed learning how to use python and pandas. I did not feel confident with my coding skills but the assignments have helped me understand more the importance of syntax. ,1,fa20
The easy going pace of learning python,1,fa20
Piazza posts and videos. They are the most helpful with answering questions and are very useful,1,fa20
The guest lecturer. She really encouraged me and gave me so much hope for the future.,1,fa20
"I've been curious about data science but didn't know where to start, so I like the structured design and introduction of fundamentals that lead into more complex ideas",1,fa20
Python coding,1,fa20
Guest speakers since it is nice to hear their experiences and advice.,1,fa20
"I like how easy the lectures are to follow, I wish classes could be in person ,but I still find the lectures enjoyable and how each video is separated according to topic rather than having an hour long video with everything combined",1,fa20
Learning about data science and working with the pandas package. Working on the group project has also been fun so far.,1,fa20
The hands on nature of the assignments without being too difficult. ,1,fa20
I have enjoyed how flexible the course is and how I know due dates in advance ,1,fa20
It is cool that we can work on a read dataset,1,fa20
Being able to learn more about data analysis skills ,1,fa20
I enjoyed working with my group and being able to explore ideas with them.,1,fa20
"I have really enjoyed applying Python to the applications in this class. Coming from a cs background, I find it very valuable being able to apply my knowledge of programming in a different field like Data Science.",1,fa20
the guest lecture,1,fa20
"The videos are really well put together, informative, and concise.",1,fa20
The assignments. They are a challenge as I am new to programing and my last coding course was years ago but working through them has been rewarding,1,fa20
The mini lectures,1,fa20
Pacing of lecture (how information is broken up into manageable videos) and pandas library,1,fa20
PAs,1,fa20
The lecture recordings + the guest lecturer,1,fa20
The quick videos that I actually remember,1,fa20
"Using what we learn in lectures in our programming assignments, something I missed in COGS9",1,fa20
Group Project,1,fa20
The lectures are interesting,1,fa20
I've really liked being able to code again as the Cogs department is rather sparse in coding courses.,1,fa20
The assignments,1,fa20
The videos are the perfect length for understanding concepts,1,fa20
Assignment is kind of difficult to me. I never learned how to google some concepts,0,fa20
"Honestly, I am not a huge fan of remote learning, I would say thats the biggest problem right now. I feel like it takes away from the actual COGS 108 experience.",0,fa20
I'm not familiar with python and panda.,0,fa20
hmmm I feel like I am a little bit lost on how to conduct the final project along the course cause we are constantly learning new techniques,0,fa20
Nothing really so far. It's been nice.,0,fa20
On the homeworks I have to consistently struggle on questions and look up functions and syntax on google because I did not learn them from lecture,0,fa20
super random but I don't like how the lecture videos don't open a new tab when I click on them from github. but obviously this is a very minor thing,0,fa20
"I don't really have any major beef with this class so far, so I can't really complain.",0,fa20
I honestly think all parts of COGS 108 has been great so far!,0,fa20
On the homeworks I have to consistently struggle on questions and look up functions and syntax on google because I did not learn them from lecture,0,fa20
Some of the assignment multiple choice questions. They can be tricky at times.  ,0,fa20
i feel like there are too many quizzes and that it is stressful to keep up with constantly ,0,fa20
